{
  "metadata": {
    "run_id": "synthetic-run",
    "generated_date": "2026-07-14T00:00:00Z",
    "agent": "03-channel-performance",
    "total_spend": 124882.07,
    "total_pipeline_attributed": 4464023.8,
    "channels_matched": 6,
    "channels_unmatched": [],
    "campaigns_matched": 18,
    "campaigns_unmatched": [],
    "data_quality_warnings": []
  },
  "channel_leaderboard": {
    "Content Marketing": {
      "total_spend": 18732.82,
      "budget_pct": 15.0,
      "leads_generated": 34,
      "mqls": 34,
      "sqls": 29,
      "opps": 24,
      "won": 10,
      "cost_per_lead": 550.97,
      "cost_per_mql": 550.97,
      "cost_per_sql": 645.96,
      "cost_per_opp": 780.53,
      "cost_per_won": 1873.28,
      "conversion_lead_to_won": 29.4,
      "pipeline_created": 1602969.63,
      "by_model": {
        "first_touch": {
          "pipeline_influenced": 1210444.75,
          "avg_deal_size_attributed": 52628.03,
          "roi": 63.62,
          "pipeline_per_dollar": 64.62,
          "rank": 2
        },
        "last_touch": {
          "pipeline_influenced": 1232736.05,
          "avg_deal_size_attributed": 53597.22,
          "roi": 64.81,
          "pipeline_per_dollar": 65.81,
          "rank": 1
        },
        "linear": {
          "pipeline_influenced": 1146718.7,
          "avg_deal_size_attributed": 49857.33,
          "roi": 60.21,
          "pipeline_per_dollar": 61.21,
          "rank": 1
        },
        "time_decay": {
          "pipeline_influenced": 1492538.61,
          "avg_deal_size_attributed": 64892.98,
          "roi": 78.68,
          "pipeline_per_dollar": 79.68,
          "rank": 1
        },
        "w_shaped": {
          "pipeline_influenced": 1202339.48,
          "avg_deal_size_attributed": 52275.63,
          "roi": 63.18,
          "pipeline_per_dollar": 64.18,
          "rank": 2
        }
      },
      "time_normalized": {
        "active_months": 11.9,
        "pipeline_per_month": {
          "first_touch": 102066.31,
          "last_touch": 103945.94,
          "linear": 96692.85,
          "time_decay": 125852.84,
          "w_shaped": 101382.86
        },
        "roi_per_month": {
          "first_touch": 5.36,
          "last_touch": 5.46,
          "linear": 5.08,
          "time_decay": 6.63,
          "w_shaped": 5.33
        },
        "spend_per_month": 1579.58
      },
      "channel_activity": {
        "first_touchpoint_date": "2025-07-04",
        "last_touchpoint_date": "2026-06-30",
        "total_touchpoint_count": 59
      }
    },
    "Email Campaigns": {
      "total_spend": 9752.82,
      "budget_pct": 7.8,
      "leads_generated": 27,
      "mqls": 27,
      "sqls": 20,
      "opps": 18,
      "won": 7,
      "cost_per_lead": 361.22,
      "cost_per_mql": 361.22,
      "cost_per_sql": 487.64,
      "cost_per_opp": 541.82,
      "cost_per_won": 1393.26,
      "conversion_lead_to_won": 25.9,
      "pipeline_created": 144979.9,
      "by_model": {
        "first_touch": {
          "pipeline_influenced": 144979.9,
          "avg_deal_size_attributed": 7630.52,
          "roi": 13.87,
          "pipeline_per_dollar": 14.87,
          "rank": 5
        },
        "last_touch": {
          "pipeline_influenced": 862863.89,
          "avg_deal_size_attributed": 45413.89,
          "roi": 87.47,
          "pipeline_per_dollar": 88.47,
          "rank": 2
        },
        "linear": {
          "pipeline_influenced": 790309.43,
          "avg_deal_size_attributed": 41595.23,
          "roi": 80.03,
          "pipeline_per_dollar": 81.03,
          "rank": 3
        },
        "time_decay": {
          "pipeline_influenced": 1327877.07,
          "avg_deal_size_attributed": 69888.27,
          "roi": 135.15,
          "pipeline_per_dollar": 136.15,
          "rank": 2
        },
        "w_shaped": {
          "pipeline_influenced": 440766.88,
          "avg_deal_size_attributed": 23198.26,
          "roi": 44.19,
          "pipeline_per_dollar": 45.19,
          "rank": 4
        }
      },
      "time_normalized": {
        "active_months": 11.0,
        "pipeline_per_month": {
          "first_touch": 13173.7,
          "last_touch": 78404.71,
          "linear": 71812.0,
          "time_decay": 120658.44,
          "w_shaped": 40050.58
        },
        "roi_per_month": {
          "first_touch": 1.26,
          "last_touch": 7.95,
          "linear": 7.27,
          "time_decay": 12.28,
          "w_shaped": 4.02
        },
        "spend_per_month": 886.2
      },
      "channel_activity": {
        "first_touchpoint_date": "2025-07-19",
        "last_touchpoint_date": "2026-06-19",
        "total_touchpoint_count": 36
      }
    },
    "Events": {
      "total_spend": 16634.26,
      "budget_pct": 13.3,
      "leads_generated": 10,
      "mqls": 10,
      "sqls": 9,
      "opps": 8,
      "won": 2,
      "cost_per_lead": 1663.43,
      "cost_per_mql": 1663.43,
      "cost_per_sql": 1848.25,
      "cost_per_opp": 2079.28,
      "cost_per_won": 8317.13,
      "conversion_lead_to_won": 20.0,
      "pipeline_created": 87422.69,
      "by_model": {
        "first_touch": {
          "pipeline_influenced": 22628.68,
          "avg_deal_size_attributed": 3771.45,
          "roi": 0.36,
          "pipeline_per_dollar": 1.36,
          "rank": 6
        },
        "last_touch": {
          "pipeline_influenced": 536048.91,
          "avg_deal_size_attributed": 89341.49,
          "roi": 31.23,
          "pipeline_per_dollar": 32.23,
          "rank": 5
        },
        "linear": {
          "pipeline_influenced": 311645.15,
          "avg_deal_size_attributed": 51940.86,
          "roi": 17.74,
          "pipeline_per_dollar": 18.74,
          "rank": 6
        },
        "time_decay": {
          "pipeline_influenced": 557763.72,
          "avg_deal_size_attributed": 92960.62,
          "roi": 32.53,
          "pipeline_per_dollar": 33.53,
          "rank": 3
        },
        "w_shaped": {
          "pipeline_influenced": 206615.34,
          "avg_deal_size_attributed": 34435.89,
          "roi": 11.42,
          "pipeline_per_dollar": 12.42,
          "rank": 6
        }
      },
      "time_normalized": {
        "active_months": 6.6,
        "pipeline_per_month": {
          "first_touch": 3426.95,
          "last_touch": 81180.74,
          "linear": 47196.41,
          "time_decay": 84469.29,
          "w_shaped": 31290.4
        },
        "roi_per_month": {
          "first_touch": 0.05,
          "last_touch": 4.73,
          "linear": 2.69,
          "time_decay": 4.93,
          "w_shaped": 1.73
        },
        "spend_per_month": 2519.14
      },
      "channel_activity": {
        "first_touchpoint_date": "2025-09-01",
        "last_touchpoint_date": "2026-03-21",
        "total_touchpoint_count": 16
      }
    },
    "Google Ads": {
      "total_spend": 37928.48,
      "budget_pct": 30.4,
      "leads_generated": 32,
      "mqls": 32,
      "sqls": 25,
      "opps": 22,
      "won": 9,
      "cost_per_lead": 1185.27,
      "cost_per_mql": 1185.27,
      "cost_per_sql": 1517.14,
      "cost_per_opp": 1724.02,
      "cost_per_won": 4214.28,
      "conversion_lead_to_won": 28.1,
      "pipeline_created": 2601490.68,
      "by_model": {
        "first_touch": {
          "pipeline_influenced": 1868819.94,
          "avg_deal_size_attributed": 77867.5,
          "roi": 48.27,
          "pipeline_per_dollar": 49.27,
          "rank": 1
        },
        "last_touch": {
          "pipeline_influenced": 612262.4,
          "avg_deal_size_attributed": 25510.93,
          "roi": 15.14,
          "pipeline_per_dollar": 16.14,
          "rank": 4
        },
        "linear": {
          "pipeline_influenced": 1044229.73,
          "avg_deal_size_attributed": 43509.57,
          "roi": 26.53,
          "pipeline_per_dollar": 27.53,
          "rank": 2
        },
        "time_decay": {
          "pipeline_influenced": 537607.74,
          "avg_deal_size_attributed": 22400.32,
          "roi": 13.17,
          "pipeline_per_dollar": 14.17,
          "rank": 4
        },
        "w_shaped": {
          "pipeline_influenced": 1405247.82,
          "avg_deal_size_attributed": 58551.99,
          "roi": 36.05,
          "pipeline_per_dollar": 37.05,
          "rank": 1
        }
      },
      "time_normalized": {
        "active_months": 10.0,
        "pipeline_per_month": {
          "first_touch": 186514.36,
          "last_touch": 61105.79,
          "linear": 104217.55,
          "time_decay": 53655.02,
          "w_shaped": 140248.34
        },
        "roi_per_month": {
          "first_touch": 4.82,
          "last_touch": 1.51,
          "linear": 2.65,
          "time_decay": 1.31,
          "w_shaped": 3.6
        },
        "spend_per_month": 3785.39
      },
      "channel_activity": {
        "first_touchpoint_date": "2025-07-26",
        "last_touchpoint_date": "2026-05-27",
        "total_touchpoint_count": 53
      }
    },
    "LinkedIn": {
      "total_spend": 27041.01,
      "budget_pct": 21.7,
      "leads_generated": 18,
      "mqls": 18,
      "sqls": 15,
      "opps": 14,
      "won": 7,
      "cost_per_lead": 1502.28,
      "cost_per_mql": 1502.28,
      "cost_per_sql": 1802.73,
      "cost_per_opp": 1931.5,
      "cost_per_won": 3863.0,
      "conversion_lead_to_won": 38.9,
      "pipeline_created": 447446.31,
      "by_model": {
        "first_touch": {
          "pipeline_influenced": 375601.22,
          "avg_deal_size_attributed": 25040.08,
          "roi": 12.89,
          "pipeline_per_dollar": 13.89,
          "rank": 4
        },
        "last_touch": {
          "pipeline_influenced": 426751.37,
          "avg_deal_size_attributed": 28450.09,
          "roi": 14.78,
          "pipeline_per_dollar": 15.78,
          "rank": 6
        },
        "linear": {
          "pipeline_influenced": 616755.04,
          "avg_deal_size_attributed": 41117.0,
          "roi": 21.81,